{
    "id": "otq-2026-11-18",
    "title": "Tango Practica",
    "types": [
        "practica"
    ],
    "series": "otq",
    "start": "2026-11-18T17:00:00+01:00",
    "end": "2026-11-18T19:30:00+01:00",
    "venue": {
        "name": "FRI Oslo og Viken",
        "address": "Mariboes gate 13, 0183 Oslo",
        "city": "Oslo"
    },
    "organizer": "Oslo Tango Queer",
    "dj": null,
    "teachers": [],
    "price_nok": 50,
    "student_price_nok": null,
    "class_price_nok": null,
    "description": "Åpen og inkluderende tangoaktivitet. Alle kan føre eller følge.",
    "source": "FRI / Oslo Tango Queer",
    "source_url": "https://foreningenfri.no/fylkeslag/fri-oslo-og-viken/aktiviteter-fri-oslo-og-viken/oslo-tango-queer/",
    "published_date": "2026-09-30",
    "first_seen": "2026-09-30",
    "last_verified": "2026-09-30",
    "crawl_timestamp": "2026-09-30T16:51:00+02:00",
    "confidence": 0.9,
    "music_style": [],
    "flyer_url": null,
    "video": null,
    "link": null
}
