{
    "id": "otv-praktika-2026-11-15",
    "title": "OTV søndagspractica",
    "types": [
        "class",
        "practica"
    ],
    "status": "scheduled",
    "series": "otv-praktika",
    "start": "2026-11-15T19:00:00+01:00",
    "end": "2026-11-15T22:00:00+01:00",
    "venue": {
        "name": "Oslo Tangoverksted (Majorstuen)",
        "address": "Kirkeveien 64A, 0364 Oslo",
        "city": "Oslo"
    },
    "organizer": "Oslo Tangoverksted (OTV)",
    "dj": null,
    "teachers": [],
    "price_nok": 80,
    "student_price_nok": null,
    "class_price_nok": null,
    "description": "Practica med en kort time (ca. 45 min) ved lokale eller gjesteinstruktører, deretter fri dans. Passer for alle med grunnleggende tangokunnskaper. Inngang 80 kr (Vipps eller kontant).",
    "source": "Oslo Tangoverksted (Google-kalender)",
    "source_url": "https://osltangoverksted.wordpress.com/kalender-oversikt-pa-oslo-og-naer-omrader/",
    "published_date": null,
    "first_seen": "2026-10-02",
    "last_verified": "2026-10-02",
    "crawl_timestamp": "2026-10-02T23:30:00+02:00",
    "confidence": 0.8,
    "music_style": [],
    "flyer_url": null,
    "video": null,
    "link": "https://osltangoverksted.wordpress.com/om-sondagspractica/"
}
