{
    "id": "tangoskolen-trening-tir-2026-11-10",
    "title": "TangoTrening med partner",
    "types": [
        "practica"
    ],
    "status": "scheduled",
    "series": "tangoskolen-trening-tir",
    "start": "2026-11-10T19:30:00+01:00",
    "end": "2026-11-10T22:00:00+01:00",
    "venue": {
        "name": "Tangoskolen",
        "address": "Nordahl Bruns gate 22, 0165 Oslo",
        "city": "Oslo"
    },
    "organizer": "Tangoskolen",
    "dj": null,
    "teachers": [],
    "price_nok": null,
    "student_price_nok": null,
    "class_price_nok": null,
    "description": "Ingen påmelding, bare kom med partner. Demo-data: utledet fra Tangoskolens ukeplan for januar 2026 – sjekk Tangoskolen på Facebook for gjeldende program.",
    "source": "Tangoskolen",
    "source_url": "https://tangoskolenoslo.wordpress.com/",
    "published_date": null,
    "first_seen": "2026-10-01",
    "last_verified": "2026-10-01",
    "crawl_timestamp": "2026-10-01T21:55:00+02:00",
    "confidence": 0.3,
    "music_style": [],
    "flyer_url": null,
    "video": null,
    "link": null
}
