{
    "id": "ktw-2027-04-09",
    "title": "Kavakava Tango Weekend Spring Edition",
    "types": [
        "festival"
    ],
    "status": "scheduled",
    "series": "ktw",
    "start": "2027-04-09",
    "end": "2027-04-11",
    "venue": {
        "name": null,
        "address": null,
        "city": "Oslo"
    },
    "organizer": "Kavakava",
    "dj": null,
    "teachers": [],
    "price_nok": null,
    "student_price_nok": null,
    "class_price_nok": null,
    "description": "Seminar og milongaer. Annonsert av Kavakava – program, sted og priser kommer («stay tuned»).",
    "link": null,
    "source": "Kavakava",
    "source_url": "https://www.kavakava.no/",
    "published_date": null,
    "first_seen": "2026-10-01",
    "last_verified": "2026-10-01",
    "crawl_timestamp": "2026-10-01T21:46:00+02:00",
    "confidence": 0.7,
    "music_style": [],
    "flyer_url": null,
    "video": null
}
