{
    "id": "otra-milonga-2026-11-09",
    "title": "Otra Milonga",
    "types": [
        "milonga"
    ],
    "status": "scheduled",
    "series": "otra-milonga",
    "start": "2026-11-09T20:00:00+01:00",
    "end": "2026-11-10T00:00:00+01:00",
    "venue": {
        "name": "Nedre Løkka cocktailbar",
        "address": "Thorvald Meyers gate 89, Oslo",
        "city": "Oslo"
    },
    "organizer": "Otra Milonga",
    "dj": null,
    "teachers": [],
    "price_nok": null,
    "student_price_nok": null,
    "class_price_nok": null,
    "description": "Ukentlig milonga med en blanding av tradisjonell og alternativ tango. Noen mandager starter med et eget program kl. 19–20. Følg @otramilonga på Instagram for endringer og pauser.",
    "source": "Otra Milonga (Instagram)",
    "source_url": "https://www.instagram.com/otramilonga/",
    "published_date": null,
    "first_seen": "2026-10-01",
    "last_verified": "2026-10-02",
    "crawl_timestamp": "2026-10-02T23:30:00+02:00",
    "confidence": 0.7,
    "music_style": [
        "traditional",
        "alternative"
    ],
    "flyer_url": null,
    "video": null,
    "link": "https://www.instagram.com/otramilonga/"
}
