{
    "id": "esa-nybegynner-2026-10-20",
    "title": "Nybegynnerkurs i tango (ESA)",
    "types": [
        "class"
    ],
    "status": "scheduled",
    "series": "esa-nybegynner",
    "start": "2026-10-20T18:00:00+02:00",
    "end": "2026-10-20T19:00:00+02:00",
    "venue": {
        "name": "Den gamle Veterinærhøgskole-barnehage (Lindern)",
        "address": "Thulstrups gate 3, Oslo",
        "city": "Oslo"
    },
    "organizer": "Patrycja Jablonska",
    "dj": null,
    "teachers": [
        "Patrycja Jablonska"
    ],
    "price_nok": null,
    "student_price_nok": null,
    "class_price_nok": 200,
    "description": "Nybegynnerkurs hver tirsdag fram til 24. november. Begge kursene samme kveld: 350 kr.",
    "source": "Tango Traveller",
    "source_url": "https://www.tangotraveller.co/tango-events-in-oslo",
    "published_date": null,
    "first_seen": "2026-10-10",
    "last_verified": "2026-10-10",
    "crawl_timestamp": "2026-10-10T12:00:00+02:00",
    "confidence": 0.8,
    "music_style": [],
    "flyer_url": null,
    "video": null,
    "link": "https://www.tangotraveller.co/tango-events-in-oslo"
}
