{
    "id": "nybegynnerkurs-i-argentinsk-tango-beginners-week-4-2026-11-09",
    "title": "Nybegynnerkurs i Argentinsk Tango (Beginners) - Week 4",
    "types": [
        "class"
    ],
    "status": "scheduled",
    "series": null,
    "start": "2026-11-09T19:00:00+01:00",
    "end": "2026-11-09T20:15:00+01:00",
    "venue": {
        "name": "Dancecity",
        "address": "Ebbells gate 1, 0183 Oslo",
        "city": "Oslo"
    },
    "organizer": "Mariano Pignatiello Tango",
    "dj": null,
    "teachers": [],
    "price_nok": 1850,
    "student_price_nok": 1100,
    "class_price_nok": 1850,
    "description": null,
    "lang": "nb",
    "translations": null,
    "music_style": [],
    "flyer_url": null,
    "video": null,
    "link": "https://www.instagram.com/marianopignatiellotango/",
    "source": "Innsendt via KI-skjema",
    "source_url": "https://github.com/Tangokalender/tangokalender.github.io/issues/13",
    "published_date": "2026-10-10",
    "first_seen": "2026-10-10",
    "last_verified": "2026-10-10",
    "crawl_timestamp": null,
    "confidence": 1.0
}
