{
    "id": "nico-2026-10-01",
    "title": "Practica med Nico Bottega",
    "types": [
        "practica"
    ],
    "start": "2026-10-01T19:00:00+02:00",
    "end": null,
    "venue": {
        "name": null,
        "address": null,
        "city": "Oslo"
    },
    "organizer": "Tango Banco",
    "dj": null,
    "teachers": [
        "Nico Bottega"
    ],
    "price_nok": null,
    "student_price_nok": null,
    "class_price_nok": null,
    "description": "Practica annonsert av Tango Banco.",
    "source": "Tangokalender.no",
    "source_url": "https://tangokalender.no/",
    "published_date": null,
    "first_seen": "2026-09-30",
    "last_verified": "2026-09-30",
    "crawl_timestamp": "2026-09-30T16:51:00+02:00",
    "confidence": 0.9,
    "music_style": [],
    "flyer_url": null,
    "video": null,
    "link": null
}
