{
    "id": "tangoskolen-milonga-minimal-2026-12-16",
    "title": "Milonga Minimal",
    "types": [
        "milonga"
    ],
    "status": "scheduled",
    "series": "tangoskolen-milonga-minimal",
    "start": "2026-12-16T19:00:00+01:00",
    "end": "2026-12-16T22:00:00+01:00",
    "venue": {
        "name": "Tangoskolen",
        "address": "Nordahl Bruns gate 22, 0165 Oslo",
        "city": "Oslo"
    },
    "organizer": "Tangoskolen",
    "dj": null,
    "teachers": [],
    "price_nok": 50,
    "student_price_nok": null,
    "class_price_nok": null,
    "description": "Dansekveld i det lille rommet – bare dans, ingen øving. Ingen påmelding. Demo-data: utledet fra Tangoskolens ukeplan for januar 2026 – sjekk Tangoskolen på Facebook for gjeldende program.",
    "source": "Tangoskolen",
    "source_url": "https://tangoskolenoslo.wordpress.com/",
    "published_date": null,
    "first_seen": "2026-10-01",
    "last_verified": "2026-10-01",
    "crawl_timestamp": "2026-10-01T21:55:00+02:00",
    "confidence": 0.3,
    "music_style": [],
    "flyer_url": null,
    "video": null,
    "link": "https://tangoskolenoslo.wordpress.com/milongaminimal/"
}
