{
    "id": "geraldina-ezequiel",
    "title": "Seminar med Geraldina Rojas og Ezequiel Paludi",
    "types": [
        "festival"
    ],
    "start": "2026-11-27",
    "end": "2026-11-29",
    "venue": {
        "name": "Oslo Tango / Sentralen",
        "address": "Oslo",
        "city": "Oslo"
    },
    "organizer": "Oslo Tango",
    "dj": null,
    "teachers": [
        "Geraldina Rojas",
        "Ezequiel Paludi"
    ],
    "price_nok": null,
    "student_price_nok": null,
    "class_price_nok": null,
    "description": "Seminarhelg med Galla Milonga på Sentralen 28. november.",
    "source": "Oslo Tango",
    "source_url": "https://www.oslotango.com/registration-cancelled/kurs-og-arrangementer/",
    "published_date": null,
    "first_seen": "2026-09-30",
    "last_verified": "2026-09-30",
    "crawl_timestamp": "2026-09-30T16:51:00+02:00",
    "confidence": 0.9,
    "music_style": [],
    "flyer_url": null,
    "video": null,
    "link": null
}
