{
    "id": "ktf-ettermiddagsmilonga-2027-05-22",
    "title": "Ettermiddagsmilonga – Kristiania Tango Festival",
    "types": [
        "milonga"
    ],
    "status": "scheduled",
    "series": "kristiania-tango-festival-2027",
    "start": "2027-05-22T15:00:00+02:00",
    "end": "2027-05-22T19:00:00+02:00",
    "venue": {
        "name": "Sentralen",
        "address": "Øvre Slottsgate 3, 0157 Oslo",
        "city": "Oslo"
    },
    "organizer": "Kristiania Tango Festival",
    "dj": null,
    "teachers": [],
    "price_nok": null,
    "student_price_nok": null,
    "class_price_nok": null,
    "description": "Ettermiddagsmilonga. Del av Kristiania Tango Festival – inngår i festivalpassene; se festivalens side for billetter.",
    "music_style": [],
    "flyer_url": "https://images.squarespace-cdn.com/content/v1/662958c1f7337823735431b1/aca7ed4f-331e-46a8-8fa0-5a29c6f47c8d/OFFICIAL+26%3A27+KTF.jpg",
    "video": null,
    "link": "https://www.kristianiatangofestival.com",
    "source": "Kristiania Tango Festival",
    "source_url": "https://www.kristianiatangofestival.com/new-page-2",
    "published_date": null,
    "first_seen": "2026-10-05",
    "last_verified": "2026-10-05",
    "crawl_timestamp": "2026-10-05T12:00:00+02:00",
    "confidence": 0.85
}
