{
    "id": "moira-sebastian",
    "title": "Moira Castellano & Sebastian de la Vallina i Oslo",
    "types": [
        "festival"
    ],
    "start": "2026-10-02",
    "end": "2026-10-06",
    "venue": {
        "name": "Uranienborg Menighetshus / Fever Dance",
        "address": "Uranienborgveien 28 og Konghellegata 3, Oslo",
        "city": "Oslo"
    },
    "organizer": "Tango Traveller",
    "dj": null,
    "teachers": [
        "Moira Castellano",
        "Sebastian de la Vallina"
    ],
    "price_nok": null,
    "student_price_nok": null,
    "class_price_nok": null,
    "description": "Workshops, privattimer, Tango Feast og gjesteopptreden på Milonga ESA.",
    "source": "Tango Traveller",
    "source_url": "https://www.tangotraveller.co/tango-events-in-oslo",
    "published_date": "2026-09-15",
    "first_seen": "2026-09-30",
    "last_verified": "2026-09-30",
    "crawl_timestamp": "2026-09-30T16:51:00+02:00",
    "confidence": 0.9,
    "music_style": [],
    "flyer_url": null,
    "video": null,
    "link": null
}
