{
    "id": "milonga-loca-2026-12-17",
    "title": "Milonga Loca",
    "types": [
        "class",
        "milonga"
    ],
    "status": "scheduled",
    "series": "milonga-loca",
    "start": "2026-12-17T18:00:00+01:00",
    "end": "2026-12-17T22:00:00+01:00",
    "venue": {
        "name": "Smelteverket",
        "address": "Vulkan 5, 0178 Oslo",
        "city": "Oslo"
    },
    "organizer": "Loca! Tango",
    "dj": null,
    "teachers": [],
    "price_nok": 100,
    "student_price_nok": null,
    "class_price_nok": null,
    "description": "Nybegynnerklasse 18–19, milonga 19–22. 100 kr inkludert klasse. Demo-data: tid og pris fra en eldre oppføring, sted: Smelteverket (Instagram) – sjekk med arrangøren.",
    "source": "Happeningnext",
    "source_url": "https://happeningnext.com/event/loca-tango-eid3a0bxq22v1",
    "published_date": null,
    "first_seen": "2026-10-01",
    "last_verified": "2026-10-02",
    "crawl_timestamp": "2026-10-01T22:05:00+02:00",
    "confidence": 0.3,
    "music_style": [],
    "flyer_url": null,
    "video": null,
    "link": null
}
